{"schema":"mr.trends/1","version":"2026-09-27T040220Z","side":"runner","restriction":"standard_balance_update_26_08","tier_group":"store","months":["2026-06","2026-07","2026-08","2026-09"],"restrictions":["standard_ban_list_26_05","standard_balance_update_26_08"],"columns":["decks_with_card","copies_sum","qty1","qty2","qty3","games_total","games_won","entries_with_card_hc","cut_with_card_hc","tournaments_hc_with_card"],"baseline_columns":["side_decks","side_games","side_wins","side_entries_hc","side_cut_hc","tournaments","tournaments_hc"],"baseline":[[3,1,3,8,7,0,0,1,0]],"cards":{"abaasy":[[3,1,1,3,0,0,1,3,3,0,0,0]],"amanuensis":[[3,1,1,1,1,0,0,3,3,0,0,0]],"amelia_earhart":[[3,1,1,1,1,0,0,3,3,0,0,0]],"bahia_bands":[[3,1,1,3,0,0,1,3,3,0,0,0]],"banner":[[3,1,1,3,0,0,1,3,3,0,0,0]],"begemot":[[3,1,1,3,0,0,1,3,3,0,0,0]],"borrowed_goods":[[3,1,1,3,0,0,1,3,3,0,0,0]],"botulus":[[3,1,1,3,0,0,1,3,3,0,0,0]],"carnivore":[[3,1,1,3,0,0,1,3,3,0,0,0]],"chain_reaction":[[3,1,1,3,0,0,1,3,3,0,0,0]],"climactic_showdown":[[3,1,1,1,1,0,0,3,3,0,0,0]],"coalescence":[[3,1,1,3,0,0,1,2,1,0,0,0]],"cupellation":[[3,1,1,3,0,0,1,3,3,0,0,0]],"curupira":[[3,1,1,3,0,0,1,3,3,0,0,0]],"cybertrooper_talut":[[3,1,1,1,1,0,0,2,1,0,0,0]],"devil_charm":[[3,1,1,1,1,0,0,3,3,0,0,0]],"dreamnet":[[3,1,1,3,0,0,1,2,1,0,0,0]],"fencer_fueno":[[3,1,1,2,0,1,0,3,3,0,0,0]],"fermenter":[[3,1,1,3,0,0,1,3,3,0,0,0]],"finality":[[3,1,1,3,0,0,1,3,3,0,0,0]],"hermes":[[3,1,1,3,0,0,1,3,3,0,0,0]],"in_the_groove":[[3,1,1,3,0,0,1,2,1,0,0,0]],"into_the_depths":[[3,1,1,3,0,0,1,2,1,0,0,0]],"jailbreak":[[3,1,2,6,0,0,2,5,4,0,0,0]],"jeitinho":[[3,1,1,1,1,0,0,3,3,0,0,0]],"keiko":[[3,1,1,3,0,0,1,3,3,0,0,0]],"lucky_charm":[[3,1,1,1,1,0,0,3,3,0,0,0]],"marrow":[[3,1,1,1,1,0,0,3,3,0,0,0]],"methuselah":[[3,1,1,1,1,0,0,2,1,0,0,0]],"odore":[[3,1,1,3,0,0,1,3,3,0,0,0]],"open_market":[[3,1,1,3,0,0,1,3,3,0,0,0]],"overclock":[[3,1,2,5,0,1,1,5,4,0,0,0]],"pan_weave":[[3,1,1,1,1,0,0,3,3,0,0,0]],"paules_cafe":[[3,1,1,1,1,0,0,2,1,0,0,0]],"pennyshaver":[[3,1,1,3,0,0,1,3,3,0,0,0]],"pichacao":[[3,1,1,3,0,0,1,2,1,0,0,0]],"pretty_mary_da_silva":[[3,1,1,1,1,0,0,2,1,0,0,0]],"read_write_share":[[3,1,1,3,0,0,1,2,1,0,0,0]],"rejig":[[3,1,1,3,0,0,1,3,3,0,0,0]],"spec_work":[[3,1,1,3,0,0,1,2,1,0,0,0]],"steelskin_scarring":[[3,1,1,3,0,0,1,3,3,0,0,0]],"stoneship_chart_room":[[3,1,1,3,0,0,1,2,1,0,0,0]],"sure_gamble":[[3,1,3,9,0,0,3,8,7,0,0,0]],"telework_contract":[[3,1,1,3,0,0,1,2,1,0,0,0]],"the_artist":[[3,1,1,1,1,0,0,2,1,0,0,0]],"tread_lightly":[[3,1,1,3,0,0,1,3,3,0,0,0]],"umbrella":[[3,1,1,1,1,0,0,2,1,0,0,0]],"underdome_irregulars":[[3,1,1,3,0,0,1,3,3,0,0,0]],"urban_art_vernissage":[[3,1,1,3,0,0,1,2,1,0,0,0]],"wake_implant_v2a_jrj":[[3,1,1,1,1,0,0,3,3,0,0,0]]}}